{
  "canonical_path": "input/instance.json",
  "canonical_sha256": "5196644df6029af2bac1e231da0c0ebe087908de06ee6b9d5423c899ef12df3d",
  "family": "att48",
  "instance_id": "att48-5196644df6",
  "m": 25,
  "n": 11,
  "schema_version": 1,
  "source_path": "data/instances/public_instance_set/att48.mdc",
  "source_sha256": "8efa61a1d9ab8fa13553ad56c76096e4c1a178a27ce03d87ca080f6c8d58a91f"
}
